Laurence Girard,The healthy living version of WebMD with telemedicine and e-commerce.
Lawqer,"A cloud-based management platform for corporate lawyers, designed by corporate lawyers. Better communication, less painstaking paper."
Lay Waste Games,"We are a tabletop game company, focused on utilizing unique mechanics and themes combined with high end materials such as metal and fabric in place of plastic and paper. Our first game, ..."
Lazy Bear,"A naturally sweet, lightly caffeinated beverage made from ingredients typically viewed as waste in the coffee production process."
Learning Catalytics,"Learning Catalytics – an engaging, data driven pedagogy, not just a technology."
LearnX,"We are creating the iTunes for mobile learning to provide the over 400 million youth around the world that are ‘left out’ of the current system due to income, rural access ..."
Leela Khan,Etsy meets Aliexpress with a South Asian twist
Legacy,"Legacy is solving the 50% decline in male fertility by providing solutions to analyze, boost and freeze sperm without the need to visit a clinic."
Legaleez,Legaleez: an advanced text editor for legal documents. Because drafting agreements should be as simple as editing code.
lehrermarktplatz.de,"lehrermarktplatz.de is a sharing-economy platform where teachers can share, sell and buy digital teaching resources such as lesson plans ."
Lemando,Lemando is a mobile app that provides underbanked Latinos with affordable financial services.
Lendelux,Lendelux is a service that allows luxury retail brands to rent high-end merchandise to customers.
Lendrr,Disrupting payday loans using alternate data and a chatbot app to better reduce defaults and dramatically cut rates.
Lesson Squad,"Lesson Squad empowers music educators to make a living through teaching with a platform that automates student acquisition, scheduling and payments."
LessonPick,LessonPick is an online lesson sharing website for teachers of English Language Learners in the United States.
LeverEdge Association,LeverEdge uses group buying power to negotiate down loan rates.
Lexica,Provides easy-to-understand legal information based on location and demographics in the form of an app and website.
Lexspot,LexSpot is the best platform for clients to find a highly qualified attorney. LexSpot’s web and mobile sites provide clients with an unparalleled attorney search experience including ...
Leyeph Wearables,Capture life and share. Wearable technology that integrates into your clothes.
LGBTQ Equality Science Campaign,This campaign employs scientifically powerful evidence to undo the lies keeping LGBTQ people oppressed around the world.
Lidify,Github for visual communication.
LifeStyle,Allowing users to post open invitations to match for activities like lunch or gatherings with friends or new people
Likha Collective,We’re an EdTech company that will close the achievement gap using virtual reality to accelerate educator skill and unearth implicit bias and prejudice
Limax Biosciences,"Strong, stretchy, and flexible hydrogel adhesive platform, based on bio-inspired materials, to seal wounds and promote h"
Limitless Laptop,We want to create the fastest laptop in the world. We’ve found that the way to achieve it is by moving hardware to the cloud.
Linxx,Linxx focuses on accelerating millennial women’s personal development and professional achievement through leadership development and civic engagement
Lion Media,Combining video games with the news industry. Through interactivity and an engaging progression system Lion Media is reinventing the news broadcast.
Literacy Labs,An animated satirical comedy following the adventures of a math coach’s first years in an urban school with low success.
LivelyHood,Lost is the small biz of yesterday with cubicles; found is the nimble biz of tomorrow sharing in ideas space and resources: LivelyHood.
Livewell Interactive,"Nugget is a social app that makes you call your mom, and do other important things to be happy, healthy, and fulfilled."
Living Biosensors,"Our technology enables living cells to sense and respond to chemicals, generating novel biosensors to improve our health and the environment."
Liwwa.com,Sharia-compliant P2P lending and investment platform.
Lizzard Fashion,"Lizzard, making science fashionable. Lizzard Fashion is a new company that seeks to promote science through fashion. We offer fashion forward clothing that is inspired by science. The ..."
Loan Markets,Loan Markets is the online supermarket for financial products with automated and tailored advisory for LatAm users: making finance easy.
Location Apparel,We use design crowdsourcing to create clothing for individuals that want apparel that represents their geographical affinities.
Loci,Loci is a service that allows people to share information with others who are (or will be) in the same location. Post or browse content specific to wherever you happen to find yourself!
Lock.In,Lock.In is a fintech startup offering tenant-default insurance for home rentals.
Locker.ly,Making life easier and safer by creating a network of storage solutions for every major city on earth. $6 = 12hrs of storage at any locker.
LoftE,LoftE helps middle-income students finance college costs and then recycles a small portion of their salary post-graduation to help successive generations pay for college.
Lollipop,Lollipop is a mobile platform that lets emerging market consumers recharge their mobile minutes by interacting with marketers and advertisers.
Longsleeve,"We have created a non-DEET based insect repellent that lasts up to 3 days with a single use, through which we hope to prevent millions of deaths."
Loo Works,Transforming plastic waste and wood waste into sturdy construction materials to create toilet structures and digesters.
Loro co,"Loro is a socially assistive robot that gives people with mobility challenges the ability to control, communicate, and c"
Lost Rabbit Games,"Lost Rabbit Games is a two-person, indie-game startup. We like shiny and fun things, and so we specialize in polished games with a lot of replay value. Paragrams’ ”our first ..."
LotusMicrosystems,A new generation of small and efficient power converters for smart electronic devices.
Love Grain,We connect Ethiopian teff farmers to $6B gluten-free market.
LovePop,Cards that show you care. Make their day with a lovepop spectacular 3D pop up card.
Ludwig,"An online platform to buy and sell handcrafted classical instruments, where buyers can find instruments and have it delivered by hourly-paid musicians."
Lumina Infinite,We support families on shifting their homes from stress to sanctuary for more connection with Self and loved ones
Luminopia,A content platform that treats lazy eye through virtual reality.
Lumos,"We make the urban bike commute safer by offering bikers a smart, illuminated bike helmet that features bright brake and turning lights."
Lundi,"Lundi is a women’s wearable tech startup, developing luxury leather boots with temperature control the user can control via an iOS app"
Lyons Hathaway Inc,"Lyons Hathaway Inc delivers strategic agile consulting services focused on harnessing value, maximizing innovation, and augmenting business results."
Made In Brownsville,We are a storefront creative solutions makerspace and think tank based in a Brooklyn neighborhood with the highest concentration of public housing in the nation. What makes us unique is ...
Magnetic Interviewing,"Magnetic Interviewing LLC helps young people ace their interviews for college, graduate school, jobs and internships."
Magpie,"Magpie lets bloggers and online publishers tag products in photos, and enables consumers to purchase those products without needing to leave the page."
Make Me a Freshman,Make Me a Freshman is an online checklist generator that shows students exactly how and when to apply to college and for financial aid. Users choose their colleges and set their ...
MakerFleet,"MakerFleet is making hardware as scalable as software by building a distributed manufacturing system, providing hardware modules that connect underutilized 3D Printers to the cloud to ..."
Mama,"Mama is a platform that allows people, particularly immigrants, to cook/sell traditional food from their country of origin that is not easily found in restaurants."
Manifold Bio,"Manifold engineers proteins for therapeutics and diagnostics through novel experiment platforms, leveraging DNA sequencing, synthesis, and machine learning."
MannMukti,MannMukti (“mental liberation”) is a nonprofit organization dedicated to ending mental health stigma in South Asian communities.
MannMukti,MannMukti (“mental liberation”) is a nonprofit organization dedicated to ending mental health stigma in South Asian communities.
Marengo,Marengo is a marketplace that enables job / admissions interview candidates to get affordable help from peer advisors via live video chat.
Mark43,"Mark43 creates the next generation of law enforcement software that allows police to effortlessly collect, manage, analyze and share information."
Marka – Markets for All,Invest equity growth capital into developing-country businesses to create innovations with significant market and social impact potential.
Marlo,"Marlo is a workplace mastery platform, starting with a tool to find and fix unproductive meetings."
MARQ,MARQ protects online retailers from false return claims by recording the packing process and sending videos to customers
MateriaLease,MateriaLease helps young ventures achieve better workspaces by offering temporary ownership of office interiors.
Matrio,A development platform and marketplace to create and share cloud apps.
MBAs Across America,MBAxAmerica is a movement of MBAs & entrepreneurs working together to reinvent business school and revitalize America. We send teams of pioneering MBAs out on the road to spend the ...
MDaaS Global,"MDaaS Global builds and operates modern, tech-enabled diagnostic centers to provide healthcare for Africa’s next billion."
me medical solutions,me medical solutions is working to provide automated tools to medical professionals to simplify and better manage the pre-authorization and billing process.
Meaningful.Care,"Oncology specialty home care that helps prepare and guide cancer patients and their loved ones to a safe, comfortable recovery at home."
Meater,Data and analytics will change how agribusiness works.
MediaSparks,MediaSparks are curated video modules that empower teachers to actively engage students through relevant discussion & classroom activities.
Medical Surface,We develop innovative coating technologies that improves the biocompatibility and performance of implanted and wearable biosensors / medical devices.
Medifuze,We are a team that is aiming to build a mobile injections apparatus in order to reduce malpractice in long term care facilities.
Medik,Medik is a point of care mobile app designed for paramedics to quickly find the information they need.
MedRhythms,MedRhythms is a neuro-rehab company helping people recover from traumatic brain injury and stroke.
Mee,Mee is a DTC female vibrator company. I want to close the pleasure gap by offering quality vibrators and sex education.
Megabook Initiative,The Megabook Initiative aims to increase children’s access to books and instill a love of reading in children through the distribution of eReaders.
Memora Health,Memora Health builds workflow productivity software for health care organizations to automate and scale outpatient communication.
Memozoid,There is a gap that exists between how we learn things and how we should be learning things – how we study and how we should be studying – and Memozoid attempts to bridge ...
Memunatu Magazine,"Memunatu is a classroom magazine for teenage girls in West Africa that promotes literacy, female leadership, and empowerment. Our mission is to create a unique, community driven ..."
Menschmark,"Menschmark is a tool to score individual social involvement, which aims to measure, incentivize, and share organized-volunteer-engagement. Menschmark was founded to address the ..."
Mentoly,Mentoly is a platform where you can book an online private consultation with a expert in any field
Mercaux,MERCAUX IS A TABLET SOLUTION FOR OFFLINE FASHION RETAILERS THAT EMPOWERS SALES ASSOCIATES TO BECOME PERSONAL STYLISTS AND CLIENT RELATIONSHIP MANAGERS. MERCAUX HELPS SALES ASSOCIATES ...
Metalmark Innovations,"Nanostructured materials for highly efficient decomposition of air pollutants, making clean air accessible and affordabl"
Meteor,"Minimalist fine jewellery with impact – sustainable, ethical, circular-economy silver & gold jewels empowering women"
Methanergics,"Methanergics is a social enterprise start-up that collects household organic waste and produces biogas and fertilizers, creating a zero waste system."
microsprout,Microsprout helps parents and students access community resources to save for college and take on less debt.
Midas Touch,Midas Touch uses 3D printing and automated audio annotations to render paintings accessible to the blind.
Mighty Mouth,"Selling dental products online, faster and cheaper"
MindMics,We are building a technology platform to help people better manage physical and emotional wellbeing be proving integrated solution of smart earbuds
Mindsprout,Mindsprout is a parent’s sidekick for child development; our app shows parents exactly what they can do to advance their child’s growth from ages 0-3.
Minimally Invasive Spinal Technology,We are developing a device and software to treat scoliosis in a more minimally invasive way to save cost and recovery.
miniPCR,Our mission is to give everyone access to DNA experimentation. Our miniPCR machine enables DNA analysis at a fraction of the cost and through a simple and educational interface.
MIPSync,MIPSync helps physicians maximize reimbursement from Medicare based on the physician’s performance on quality measures compared to his or her peers.
MiRobotix,Robotics Processors for Unlocking Intelligent Applications on Autonomous Vehicles and Robots
MiSET Publication Standards,Creating a research-driven peer-reviewed resource to publish reproducible biomedical research experiments
Mismatch,Mismatch is a realtime video platform that connects U.S. middle and high school classrooms across distance and divides.
MIWU,"Filtering, storing, and reusing street water runoff in the form of a new civic amenity."
MixTape,Mixtape combines the ease of music streaming with the sentimentality of mixtapes to help you share music more meaningfully with the people you love.
Mobile Connect,"We want to create opportunities for poor entrepreneurs in the cities by connecting them to richer households, better financing , and MFIs."
Mobilizr,Mobilizr provides homeless individuals in transitional housing programs with digital access in the form of Wi-Fi enabled devices and program support to increase their chances of ...
Mobius USA,We use literacy to teach children English.
Mobley,Mobley is building a convenient and affordable alternative to furniture ownership through its rental system.
Moby,Moby is a SMS chatbot for community health workers in developing countries to manage patients and supplies.
Mocura,Allows viewing of medical images with a smartphone using Augmented Reality to control viewing depth and angle.
MODAR,"Creating the most natural, physician-centric platform with AI-assisted augmented reality glasses to significantly streamline a physician’s work."
modern mammals,creates better hair washing products for men to replace shampoo and conditioner
Modular CPAP,A continuous positive airway pressure (CPAP) device that provides respiratory support to children in resource-limited settings.
Mokha Origin,"In 1450 Sufi monks in Yemen discovered coffee. Mokha Origin imports & markets this historic beverage, encouraging Yemen’s growth & stability."
"Molecular Loop Biosciences, Inc.",Molecular Loop is commercializing a technology to accelerate basic genomics research and expand access to clinical and consumer genetic information.
Momentum,A specialized venture fund designed to develop novel treatment solutions for psychopathologies.
monemo,We tally the available water through blockchain to create conscientiousness and accountability of day-to-day consumption
MoneyMoves,MoneyMoves creates a bridge between those looking to invest their money to individuals capable of investing for them.
mopi,mopi is a network of home-based daycare centers in Brazil.
Mosaix,Mosaix is an Electronic Medical Record (EMR) System. It is the first brand of a startup company called MedKingdom that has been incorporated to develop medical informatics technologies. ...
Movement Mississippi,A hybrid fitness center offering community classes focused on healing/resistance plus after school youth programming.
Moving Metrics,We are creating the first enthusiast driven ad-network where brands pay niche vloggers to use & review their products in YouTube videos.
Mozambique School Lunch Initiative,The Mozambique School Lunch Initiative links agricultural investment to school feeding programs to improve food security.
Mr. Fitzroy Toy Delivery,Kids toys made fun and easy.
Mudango,"Mudango, an on-demand solution for moving your stuff, is addressing the 5 bn market of moving services in Latin America."
Muscan Thermera,Muscan Thermera is a device that scans the muscles of pain and generates a heat map of the intensity of muscle strain
MUSEY,Musey is a geo-location based app for art and cultural events in the 21st century.
Music Go Global,Music Go Global is an online platform that connects young music educators with children around the world to learn music.
Mustard Venture Studio,"Mustard Venture Studio dresses companies for their next value event by inserting a temporary management team that executes on a multi-faceted, valuation-driven plan."
Mutual,Use data analysis to simplify team productivity use cases and enable intelligent push notifications on mobile devices.
Muud,Muud is an emotional artificial intelligence company developing software providing real-time predictive emotional analytics for media and advertising.
Muvanza,Moving is painful. Finding a reliable mover is hard. Comparing prices is impossible. Muvanza will change that. It’s easy. You register your inventory once and we take care of the ...
MyBetterFit,MyBetterFit intelligently predicts an individual woman’s side effects to different hormonal birth control to find her the best fitting drug.
Mybrary,Mybrary is a network of co-share study spaces providing workspace and wi-fi for students taking online courses.
MyLingo,MyLingo aspires to bring the magic of the movies to non-native English speakers through the innovative application of proprietary audio synchronization technology. MyLingo is the first ...
myProxy,myProxy using technology to document and access patients’ end of life care wishes. myProxy gives you a voice in your care.
myRoadways,"myRoadways flips the traditional internship search, allowing companies to search for students and have them apply directly through the site."
MySporties,MySporties is an animation startup with a new interactive blog & eBook series that teaches young kids how to succeed in life thru sports.
MyToolbox Technologies,"Labor marketplace for skilled blue collar workers, offering them a platform to secure jobs, manage licenses, and access basic financial services"
MyZooPets,"MyZooPets creates a multi-platform virtual pet game teaching and motivating kids to manage chronic conditions. We are first focused on asthma, then diabetes. Our five co-founders met at ..."
Naked Petcare,Naked Petcare makes products for your pooch that are nothing but natural. From organic dog shampoo to natural paw balms and deodorizing sprays.
Nalagenetics,Cost effective genetic testing for drug metabolism in Asia.
NanoBright,"Offer non-invasive cancer prognosis, monitoring and screening with unparalleled accuracy"
Napatree Sandals Co.,Napatree is a sandal revolution. Say goodbye to unoriginal options and the inevitable summertime blisters; the bespoke sandal has arrived!
"Napkin, Data Science Toolkit Simplified","Napkin is a statistical toolkit for machine learning engineers and data scientists to better clean, parse, and visualize data."
NarrowTheGap,"Global poverty app for individuals to donate to the world’s top three charities, while corporates match donations."
Nature,"Nature enables smart control over room ACs by Smart AC Plug. The device is capable of controlling power to the AC unit, connects to local WiFi, and has infrared and multiple sensors. ..."
Nature Buddy,"A technology platform to promote green spaces in urban settings to combat climate change & pollution, grow your own food and mainstream Nature."
Naya Studio,A digital platform for affordable personalized furniture. We take you from idea to product delivered to your door.
Nearsighted Globe,"NG has developed a high science, low cost, easy to use tool for diagnosing nearsightedness targeting remote communities."
Nebula Genomics,Nebula Genomics is using blockchain to reduce the costs of personal genome sequencing and enhance genomic data protection.
Need in Deed,A platform to connect design students with real issues and tasks in the society
NeighborGood,"NeighborGood matches chronically ill, disabled, and elderly individuals with volunteers in their neighborhood for help with home tasks and errands."
Nella,"Nella is a digital platform providing instant medical advice to vulnerable families by combining smart algorithms, digital tools, and live nurses."
NeoClosure,"Inspired by a man who has difficulty dressing due to lost fine motor control, NeoClosure is a versatile magnetic seam that can be incorporated in many garments. The magnets are ..."
Nesuku,"Provide 1) a tool for private teachers to manage finances, create promotions, schedule lessons, & process payment, & 2) consulting to garner students"
NetworkMe,NetworkMe is a complete “Network Job Search” management tool that will let you find contacts in companies across multiple social networks as well as student and alumni ...
NeuNav Mini,"Our idea disrupts the neuronavigation sector with a low-cost, portable solution for bedside neurosurgical procedures"
NeuronSpike Technologies Limited,Developing brain-inspired AI processors to power autonomous technologies with energy-efficient and adaptive intelligence
New Kids,An in-person and online information resource and support network for pregnant women and new moms.
New Majority Community Labs,Empowering communities of color to identify and build solutions to their own challenges using big data and community engagement tools.
New Teachers Thriving,"There are more than 200,000 first-year teachers. Tens of thousands will quit. It’s a crisis. We provide trainings to help districts fix this problem."
Nex2us,Nex2us is a platform connecting classrooms around the world through images & critical classroom discussions to promote understanding across cultures.
Next Wave Hire,"LifeGuides.me helps users successfully navigate challenging life events, for free."
NGO network in China,A platform that makes it easy for people to help each other through real world actions and inspires goodwill through collective stories.
NIC – Nichrome Icicle Cutter,"The Nichrome Icicle Cutter is a device that removes overhanging ice formations in the fastest, safest, and most cost effective way possible."
Nics Kitchen,"Nics Kitchen is a clean-ingredient, packaged-food business with offerings that are free of gluten, nuts, soy, dairy and tapioca."
Nidit,"Oftentimes our friends can and are willing to help us, but the problem is that most of them just don’t know what we need. While most people are willing to help, less than 20% of ..."
Niimble,Enabling K-12 leaders to make data driven decisions by creating understandable and actionable analytics from existing but underutilized data.
Nilus,"Nilus is building a sharing-economy model of food waste rescue, where private drivers pick up food in edible condition and deliver it to community kitchens and shelters."
Nimbly,Nimbly is a 3D knitting automation platform that powers the mass manufacturing of on-demand and customized products.
Nivien Therapeutics,General Biotechnologies finds and develops innovation from tech transfer portfolios at top hospitals and universities.
Nix,Nix is a consumer diagnostic company currently developing its initial product: a wearable hydration sensor that empowers athletes to mange their hydration status in real-time.
Nix Institute,"We will create evidence-based new technologies to reduce corruption, violence, and organized crime in Latin America."
Noken,Noken is reimagining the tour operator concept for millennials by curating instant-bookable itineraries that are guided through our signature app.
Nom Pot,Healthy one pot meals for easy home-cooking
Noma,"Noma enables users to view a live tab, pay without waiting for a check, and share your experience. All from your mobile device at restaurants, bars and clubs."
Nomad Life Digital,"Nomad Digital Life is a cross-border platform for traveling experts to manage their health, finance, and legal data and documentation on-the-go."
NomAway,"Tired of calling to order or waiting in line? Order and pay in advance on NomAway’s mobile app and just grab and go. No lines, no hassle."
nooLoop,"nooLoop is an online warehouse that inventories construction materials, tools, and machinery for transactions, aiming to minimize waste in the building."
Nootra,"Nootra is a simple, real-time social-commerce platform on any screen that socializes online shopping and saves users time and money."
NoSilo,NoSilo’s mission is to eliminate data silos in business as a third party enabler of privacy-upholding data alliances.
