“Waspita Blood Bank Solutions”,A digitally optimized blood bank management platform to enable African hospitals interface in blood product distributio
"1,000 More",It facilitates crowd-funding lobbying efforts so that average Americans have access to that part of our democracy.
1Room,"1Room delivers an individualized high school education through offline tablets in one room, with a single staff member."
2store1,2Store1 addresses the retail real-estate crisis in Lebanon through occupancy matchmaking and playful spatial solutions.
3LEVATE,I will help companies design and implement apprenticeship programs which will allow them to both skill up and diversify.
3Shots,An application for finding a social place that fits you.
7Wells,"Authentic, high-performing and ultra-sustainable apparel made from and for where the desert meets the sea."
A Better Future,ABF Aims to Become the World’s Leading Cross-sector Talents Sharing Platform
A Place in the Sun Foundation,A Place in the Sun Foundation is a non-profit organization founded by former Peace Corps volunteers and Harvard grad students to improve the quality of early childhood education in West ...
A to Z,Friends share information about international travel that is normally fragmented and unreliable on the internet
Abraze Engineering,Abraze creates commodity and specialty metals using a sustainable process.
Abridge News,We get people out of their news echo chambers by making it easy to engage with a wide spectrum of opinions on important stories.
Accelorithm,Accelorithm is an adaptive learning algorithm that optimizes learning capacity and efficiency for students studying in the science and medical fields.
Accure Health,"Accure Health develops and integrates miniaturized biosensor technologies and digital healthcare solutions to enable fast, cost-effective and highly accurate cancer diagnosis in ..."
Ace,"Ace is a branding agency that provides models, social media content, Photoshop editing, and influencer marketing for bra"
Ace Airways,"Ace Airways is a boutique, product-focused airline that transports overseas visitors to Las Vegas and other US leisure destinations, transforming both customers’ expectations and ..."
Ace-up,Ace-up aims to be the go-to marketplace for coaches. Our mission is to help coaches develop their business and help people get better coaching.
ACEA,Healthcare’s Definitive Resource for Continuing Education.
acelab,acelab empowers ACE professionals to make responsible choices through preconstruction intelligence.
ACOSys,"Managing risk is key to managing healthcare costs; effective communication makes it scalable, we aim to do both #ACOsys."
Acrobatics Circus Troupe,We use acrobatics and education as a foundation to fight poverty.
ACT.md,"Accountable Care Transactions, Inc. (ACT.md) promotes efficiency and cost reduction in healthcare by enabling, supporting, and monitoring coordinated teamwork among the cluster of ..."
Actiify,"Creates a platform that creates, organizes, and runs events for people to meet, socialize, and interact."
Active Parenting,We enable parents to carry out high quality interactions with their children through fun and simple activity videos.
ActivePepper,A location-based mobile application that helps active people find the right sports partners and book sports facilities for their games.
Actual,"Actual creates sophisticated, custom investment plans for consumers and provides tools for investment advisers to evaluate complex financial products."
adapptED,adapptED making learning more effective by helping students and teachers identify and overcome the specific misunderstandings they have.
Aday Technologies,"Aday is a B2B human resources and operation platform that enables a paradigm to hire, schedule, and train employees"
Aditum,ADITUM is a medical e-learning platform. It provides health experts with an easy and simple way to create and share interactive medical cases.
AdmitHub,We make the college admissions process awesome for everyone involved.
adtime,adtime is a mobile platform that lets emerging market consumers recharge their mobile minutes by interacting with marketers and advertisers.
Aeiyr,We develop affordable wearable health device to monitor respiration. This is a solution to provide feedback for sleep apnea therapies
Aerospec Technologies,We use computer vision technology to accurately analyze asset anomalies
AESOP Technology,AESOP Technology aims to create a “smarter” prescription error detection system through machine-learning technology to enhance patient safety.
Aethos,We centralize fragmented athletic content throughout the web and organize it by athlete in order to create a platform that connects the athletic world.
Africa Healthcare Network,"Africa Healthcare Network aims to establish the first dialysis chain in Sub-Saharan Africa, offering high-quality, life-saving care at affordable cost. AHN combines world-class ..."
African Health Institute,Partnering with on-ground organizations to amend or optimize an accredited emergency healthcare training curriculum.
African World Entertainment (AWE),"A subscription-based streaming service that provides African film, music, news, and sports on-demand on internet devices"
Afriponics,Creating a network of greenhouses with sub-saharan adapted aquaponics units to eliminate produce imports.
After Flowers,"Left over event flowers = waste. After Flowers creates a mktplace 4 SMBs & indivs 2 buy this inventory 4 less, returning sunk costs to hosts."
AfterSteps,TurboTax for Death Preparation.
afyakit,"afyakit is powering cheaper, better informed care delivery by providing actionable, right-level analytics to health managers across Sub-Saharan Africa"
Agenda28,"Agenda28 designs digital products that create social impact for the end users of our products, our employees and the poverty-relief sector."
Agile Devices,"Agile Devices aims to transform a wide variety of interventional procedures, resulting in improved patient outcomes and large cost savings."
Agora,"Agora is a community of young Japanese female professionals, gathering together to inspire and support each other."
Agora,Agora will introduce a dialogue-based learning model to Japanese schools and businesses.
Aha!,An engaging web platform that connects unmotivated high school students with guidance counselors to have AHA! moments about their interests.
AIdentimages,"AIdentimages aims to change the way that doctors analyze medical images through AI, machine learning and 3D reconstruction technology."
Aikili Biosystems,"For breast cancer patients who lack access to effective diagnosis, Aikili provides a low cost, automated, accurate diagnosis at the point-of-care."
Airfox,"Using mobile and blockchain technology, Airfox is bringing financial inclusion to the billions of unbanked people in emerging markets."
Airr,Airr is building a better way to consume and share podcasts.
AirSkin,Oxygen and CO2 embedded wetsuit to protect surfers.
Akouos,Akouos is developing novel therapies and delivery systems to prevent hearing loss and restore hearing in genetically defined patient populations.
Aldatu Biosciences,Aldatu Biosciences is a biotechnology company applying its proprietary genotyping platform – PANDAA – to the development of innovative diagnostics designed to meet unmeet clinical needs ...
Algorithm,"Our algorithm can examine large percentage of known drugs all at once, and not one by one, as done by the existing algorithm and drug repositioning companies."
Aliro Quantum Technologies,Software to make today’s quantum computers accessible and useful to any software developer.
AllHere,AllHere is an app that increases K12 school attendance 10% a year by notifying families of student absenteeism and improving family engagement.
AllSpice,AllSpice is a software tool that lets hardware engineers automate their development and collaborate on designs.
allyDVM,"allyDVM, Inc. is the ultimate ally for doctors of veterinary medicine. allyDVM consists of two parts. First, it is a practice owner’s association that provides independent animal ..."
AlmaPact,"AlmaPact offers a new way to pay for school, where a student receives their required funding and, in return, guarantees a percentage of their income."
Alpha Vantage,Cloud-based financial market data & analytics platform
AlphaInvest,"AlphaInvest is an online platform that will democratize investing, bringing institutional-quality investment management to the broader market."
Ambasity,Ambasity streamlines the process in which freelance brand marketers are both hired and managed. The portal makes it easy for people to find and manage great talent for their events.
Ambika Botanicals,"Ambika Botanicals, natural and botanical body care products rejuvenate our connection with nature’s vitality."
Amble,"We developed an undergarment pair of leggings that reduces joint pain and stiffness, prevents muscle atrophy and integrates seamlessly into daily life"
Ameba,The Revolution of Education Technology
Amplify,"Amplify enables anyone to benefit from their social media presence, and helps brands market themselves through the social networks of their customers."
Amplify App,An app connecting local students and young professionals for career discovery beyond their typical social circles
AMRx,AMRx creates innovative solutions targeting antimicrobial resistance.
Analytical Space Inc.,ASI provides a data downlink service that enables satellite operators to get up to 3x more data back to the ground at a lower cost per GB.
"Anamiv, a healthier world","Anamiv is a sustainable business model for applying mHealth for the provision of evidence based primary healthcare in resource-restrained settings. In addition, the data generated will ..."
Anantara,"‘Anantara’ converts collector-only economies into craftsmen communities whose culturally rich, value-addition positively reinforces the environment."
Andon Analytics,"Andon Analytics reports on how your manufacturing lines are operating. Get real-time visibility, analytics and insights with a high degree of accuracy."
Angel Carrier,Angel Carrier is a logistical solution that utilized travelers’ unused baggage space to transport goods to people in need all around the world.
Antera Therapeutics,We are preventing allergy developments in infants.
Anuel Capital,Our enterprise solution is designed to help pay-as-you-go solar companies generate loan notes and power purchase agreements for unbanked communities.
ApnaTXT,Delivering information about child development and care to help mothers understand the factors influencing early childhood development.
AppStarter,AppStarter believes in the power of ideas and wants to level the playing field for the millions of mobile users with innovative app concepts but limited technical skills. AppStarter ...
AppSuccess,AppSuccess uses an interactive online platform to help low-income students who are qualified to go to college with the means to get there.
Aqua Bridge,"Safe drinking water through integration of water filtration, microbiological testing and a web-based Information Communication Technology."
Aqua Novus,"We reinvent water testing so everyone can better understand the water they drink daily. The key is a cheap, portable and easy-to-use water biosensor."
AquaPlastic,To mitigate the menace of plastic pollution we have developed AquaPlastic that is water-processable and biodegradable.
ArbiLex,"ArbiLex develops predictive analytics for international law, empowering international lawyers to make data-driven decisions in the most complex multi-jurisdictional cases."
Arbothera Inc.,Arbothera is creating a rapid response platform to combat global infectious diseases by designing “hyper” rational vaccines based on pathogen genomics and host immunological pathways.
Arcbazar,"Arcbazar is the first-of-its-kind crowdsourcing platform for architectural, interior and landscape design projects."
Archipelago,"Archipelago is a global, online, literary news magazine focused on issues of economic and political development. We focus on sourcing and developing aspiring writers or journalists from ..."
architect,"architect offers a drag-and-drop data science platform for creating, visualizing, and training machine learning models."
ArchSpike,ArchSpike aims to streamline the process of building design and development by integrating real estate market analytics with design software.
Archway Health Advisors,"Archway Health Advisors LLC provides advisory services for the healthcare industry. The company designs, executes, and finances care and risk management programs for providers. Its ..."
Arecibo,"Designing the future of life & work on the Moon, Mars, and the space in-between through a better human/machine relationship."
AreteX: Objective Assessment of Pain,Objective Method for Pain Assessment
Aretian Foundation,"To provide healthier, fresher meals affordable to urban communities by purchasing, processing, and distributing local food from New England farmers."
Art and Resistance Through Education,"Using art, design, and technology to educate and empower young people to develop creative solutions and bring awareness to local and global human rights challenges."
Artilion,"An elegant, robust and connected men’s weekender bag that kicks-off a French based, globally driven fashion brand for millennials."
ArtLifting,ArtLifting is a social enterprise that empowers homeless and disabled artists through the celebration and sale of their work. Many skilled artists participate in art groups at hospitals ...
ArtNext,"ArtNext is art as a subscription model. We are growing access to the art market by bringing gallery holdings to your home, at a fraction of the price."
ARTS,"Arts develops augmented reality applications for enterprise and consumer markets, focusing on training and perfecting sensorimotor skills."
ArtUp,"ArtUp will bring affordable artistic creations to everyone, unlock the potential of promising artists and be an alternative to the art mass market"
Asian Women’s Leadership University Project,"Establishing the first global women’s leadership university for women in the Middle East and Asia to cultivate a cadre of women leaders to advance social, political, and economic ..."
ASPEAK,Why should emerging scholars speak or write for free? We connect scholars with galleries and cultural institutions.
Aspyre Growth Accelerator,Aspyre develops management and system capabilities for high growth Agro-enterprises in Africa.
Aster,Aster is an mobile app that allows college students to receive support for mental illness from peer counselors.
Astoria Road,"Astoria Road (“AR”) is a new kind of wedding registry for the Net-Generation. AR provides a superior user experience through advanced social-media integration, a more intuitive user ..."
Astraeus Technologies,"We are building the L-CARD, a simple, inexpensive, breath-based lung cancer diagnostic test."
At Your Service,"At Your Service is a personalized online delivery and pickup platform offering services like grocery, alcohol, laundry and general pickup and drop-off."
Atelier,Atelier is an experience that combines the best in VR technology and brain research to deliver a personalized therapy that unlocks your creativity
Atomysis,We design a smart device installed onto a toilet and it automatically tests urine sample whenever a user pees to interpret health conditions.
auggi,auggi helps individuals with chronic gut disorders make better everyday decisions to keep symptoms at bay
AUGMENTx,We play a visual mind trick on the brain using augmented reality to accelerate neurological recovery in patients.
Auris,Auris allows consumers to self-diagnose and treat hearing loss at a vastly lower price than existing healthcare options.
Aurora FemTech,"Access to world-class contraception and fertility solutions, personalizing recommendations to meet sexual health goals."
Avant-garde Health,"Avant-garde Health empowers hospitals and clinicians with information and insights to deliver the highest quality, most cost-effective care."
Ayanda,"Ayanda uses offline technology to discover vendors, items, and to message other users entirely without the internet."
B.Mixt,"Be Mixed is a zero-calorie cocktail mixer in natural, mixology-inspired flavors that allows you to enjoy what you drink without the guilt. You’re better than a vodka soda."
Bab’l Books,Bab’l Books is dedicated to bring children’s books in all languages.
Babel @ Home,"Babel@Home is a translator for IoT languages, enabling customers to integrate new devices regardless of the protocols."
Baby Bidet,"Diapers are polluting, expensive & gross. Baby Bidet alerts parents BEFORE baby goes, provides potty & cleaning system."
Baby Buggle,"Baby Buggle allows parents to rent durable, non-emotional baby products, saving time, space, and money, we are Zipcar for baby products."
BabyCity,"As more parents enter the workforce and demand childcare and babysitters, they have become increasingly concerned about quality in early education. While daycare centers support ..."
BACprep,BACprep is the first large scale provider of affordable test prep services in francophone Africa
Bahasa,You can learn a new language while reading your click-bait articles.
BairSkin,BairSKIN is an oxygen- and CO2-embedded wet suit that provides a surfer with protection against drowning.
Baleen,"Baleen Labs has invented a new paradigm in database security, which will alter how information is stored and shared in enterprise settings."
Balloon,Balloon is a location-based event sharing app that helps users find where classmates are working together or meeting up.
BallotBox,"It incentivizes and randomly samples individuals to respond to election polls, profiting off subscriptions and data."
Bandshee,Wearable emergency response network that you won’t notice until you need it.
Bantu Coffee,Bantu sells specialty coffee and invests a significant portion of profits into coffee farmers and connects consumers to producers.
bao,"Stylish, multi-use and sustainable handbags that flatter but also matter.Handmade by women for women who want both the sustainability and the chicness"
Barato,"Safe, affordable medical procedures abroad."
Baroo,"Baroo provides convenient, high quality care for city-dwelling pets. Baroo offers full service pet care, conveniently delivered to your door. No need to dash home for a mid-day walk or ..."
Base 15 Studio,Base 15 Studio is a creative consultancy that revitalizes city culture through collectively organized action.
Base Operations,Everyone deserves to feel safe. Base Operations creatively uses data to help people and businesses make better decisions when it matters most.
bcalm,A natural wellness drink for mental clarity and stress-relief.
Beacon Biomimetics,PhonoGrafts 3D-printed from novel biodegradable ink can repair damaged eardrums and passively enhance sound conduction.
Beacon Genomics,Beacon Genomics enables safer genome editing via its exclusively licensed off-target specificity assays: GUIDE-Seq and CIRCLE-Seq.
BEAM,"In 2012, Bridging Education And Mobility (BEAM) was founded on the vision that anyone with an idea for a transformational educational project would have the funding and resources to ..."
BEAUTY LIES TRUTH,Pure. Powerful. Unformulated. Skincare.
Beauty Touch,fabulous products on-demand.
BeautyMotive,"BeautyMotive is the most innovative and effective marketing channel for cosmetics brands. We connect brands to our network of the most influential, passionate, and professional makeup ..."
Bebelot Detroit,"BEBELOT Detroit is an innovative design company that brings customizable, locally designed and produced trashcans to your interior."
bee me yogurt,"bee me yogurt seeks to bring fresh frozen yogurt to all of you: cafés, canteens, cinemas, gyms or just to your office. Our no-maintenance solution brings you not only the freshest ..."
BeenThere,"BeenThere provides online, 1-on-1 peer support to improve the mental wellness and personal development of Chinese youth."
BeFree!,BeFree! is developing a vaginal drug delivery platform technology to tackle areas of high met medical need in women’s health.
Beli,"An app optimized for finding, tracking, and sharing restaurants that provides reliable personalized recommendations"
Bensen,Bensen AI helps restaurants take more orders with fewer employees by automatically answering the phone as well as taking orders by text message and voice assistant. The company helps ...
BestReviews,Using big data to help consumers make the optimal product decision.
BetaDater,"BetaDater.com is web service that provides honest, anonymous, constructive feedback to empower you to maximize your dating potential."
BetterFit Technologies,BetterFit Technologies uses predictive analytics and natural language processing to engage with patients unlike anyone else. Their prediction engine anticipates individual reactions to ...
BevSpot,B2B platform for the $450B alcohol distribution industry better connecting licensed parties and enabling them to more easily transact.
BigEd,"BigEd is a web platform that weaves together the world’s best university courses into one unified map of knowledge, on the concept level."
BikePath,BikePath tells bike and scooter sharing companies where to equitably and efficiently place bikes and scooters.
BillCrew,We connect people with large medical bills with experts who help them negotiate and reduce them. Because dealing with an illness is hard enough.
bio.x,x.bio provides a cost-efficient individual-tailored therapeutics platform for human diseases.
BioDevices,Biodevices is making knowledge more accessible by changing the way science is done.
BioDiscovery,"Genomic data analyses for cancer (research / LDT clinic applications), and constitutional cytogenetics (pre- and post-natal, and research). DNA copy number and structural variant ..."
BiomaRx,"BiomaRx is a promising oncology-focused startup focused on the diagnosis and treatment of pancreatic cancer. We are spun out of Harvard Medical School and BIDMC, with global IP secured. ..."
BiomassTrust,"To transform bioenergy using a disruptive IP, capable to open the international market of biofuel for tropical countries"
Biomiic,A platform to effectively discover bacterial DNA in poop.
Biosay,"Biosay lets people see how their surroundings and relationships impact their health in real-time, via biometric measurements."
Bit Farm,We use local farm data and advanced machine learning algorithms to predict crop yield and improve farming decisions.
Bizmpya,Bizmpya provides Kenyans with an online platform to buy and sell foreign and domestic goods and services.
Black Box Traffic Incentives,Using a black box to give give discounts on toll roads to good drivers to reduce phantom traffic and improve road safety
Blackwell Timepieces,Blackwell Timepieces: veteran-owned startup manufactures high caliber watches that provide service dogs for wounded vets. One Watch = One Dog.
Blank Schools,Blank Schools catalyzes innovation in the education sector by supporting innovators to design and launch radically different new school models.
BlocKardia,BlocKardia is a decentralized marketplace that connects smart devices to the gig economy.
Blue Box,"To provide access to clean drinking water by creating a sustainable, simple, and mobile water filtration system."
Blue Capital,Blue is your automated investment advisor that tailors and manages your own global portfolio. All of this in a simpler and cheaper way.
Blue Skies,We reduce the health toll of air pollution
Blue Therapeutics,"We are developing potent, non-addictive painkillers."
Bluelaces Theater Company,"Bluelaces Theater Company creates immersive, multi-sensory theatrical experiences for audiences with autism and other developmental differences."
Bobea Group,Bobea is a sustainable agriculture and social empowerment company. Our initial operations will be based in Kenya.
Bon’Ap,"Eat healthy at work: register your health profile and your nutrition goals, we guide you to order, deliver meals to your office, and track your diet!"
Book in a Box: Rise Book Series,"An interactive book series where young girls are given the opportunity to create, build and amplify a storybook in an online community."
Booya Fitness,"Booya Fitness, Inc. is an online platform for on-demand fitness videos. The platform provides an integrated experience to allow customers to overcome their personal hurdles towards a ..."
Boréas Semiconductor,Boréas provides longer battery life by reducing the most important metric in today’s touch enabled electronic systems: power consumption.
BossGirl,We connect senior women leaders with ambitious women for mentorship to break the barriers that prevent their empowerment
Boston Foods,"At Boston Foods, our mission is to make healthy, fresh, high-quality food available to food insecure communities."
Boston Votes!,"Through our college-high school mentorship program, BV works towards 100% civic engagement in MA high schools and beyond"
Bounce Imaging,Bounce Imaging builds throwable tactical cameras and sensors to keep first responders safe.
Boxed Nutrition,Boxed Nutrition is an online health food store that ships nutritious and environmentally sustainable products to your door in a box!
BrainCo,"We are BrainCo. With experts in the field of the most advanced brain and neuroscience, we work our hardest to bring Brain-Machine Interface (BMI) out of science fictions."
BrainSpec,"BrainSpec is a software platform that enables efficient, accurate, and non-invasive diagnosis of brain disorders."
BrandQR,"We take brands, logos and graphics and turn them into fully functioning QR codes!"
Breaktime,Breaktime prevents long-term chronic homelessness by launching the careers of young adults experiencing homelessness
