Ditto,"We help companies use their sales data to find high performing stores, avoid bad ones, and allocate inventory using demographic data."
Diva,Diva is an educational app that changes the way people learn and practice singing by providing personalized feedback and lessons.
DIVchive,"A diverse digital and physical archive of elementary, secondary, and post-secondary student work accessible publicly."
DiverCity,"An online platform that channels advice from larger corporations to small businesses, helping the latter to win corporate contracts."
Diverso,Diverso is a student-run film fund that aims to eliminate the socio-economic risks for young diverse filmmakers through fellowships and grants.
Docutribe,Docutribe is a crowdsourced multimedia initiative that drives social change for young people.
DoneGood,"More and more of us want to support businesses doing good for people and the planet. With DoneGood, you can easily find businesses that share your values."
Donut,“Donut” is a technology based platform to encourage small donations by engaged millennials to create a habit of giving.
Doorbell,Doorbell helps apartment building owners improve property income by creating a sense of community for residents through our app and event experiences.
Dormhop,At Dormhop we want to revolutionise the way college students interact by leveraging the simple act of sharing one’s dorm with a fellow student.
Dotacle Technologies,A cost-effective alternative to prescription glasses for patients in resource-limited settings using pinhole lenses.
DozeOn,DozeOn is an Apple Watch application that detects driver drowsiness and alerts the driver before they doze off.
Dreamporte,Dreamporte is a non-profit organization that provides an educational program that uses hands-on activities and virtual reality technology to immerse its students in their studies.
DreamworldVR,We combat loneliness and help develop emotional & social intelligence for isolated pediatric patients
DreamxAmerica,DreamxAmerica (“Dream Across America”) joins filmmaking and impact investing to highlight and support immigrant entrepreneurs in towns across America
DrivenData,"At DrivenData, we use big data for social impact. We host well-structured online competitions where contestants apply cutting-edge practices in data science to some of the world’s ..."
droplit,We build intelligent hardware that enables the future of e-commerce.
Dwelling,Primary care for homes: A managed home maintenance service easing the burden of repair and improvement projects
DYLI,"dyli is a mobile-first fashion magazine that uses adaptive algorithms & innovative social features to create an engaging, personalized UX."
DYML.io,"DYML.io creates accurate, real-time, reconciled medication lists from multiple sources to empower patients."
Dyscern,DYSCERN provides screenings for dyslexia to people all around the world without access to financial or physical location
Dystrophic,"dystrophic is a game development studio creating Hexile, a surreal puzzle game based on themes of environmentalism and social awareness."
E Pluribus,We empower youth to share actionable content on the issues they truly care about
Earthafé,Earthafé is the high-tech rewarding software-café network that connects people to their coffee sources farmers &habitats
Easy Shoulder,Easy Shoulder is making a smartphone app to help you understand your painful shoulder condition – and lead you to more effective rehabilitation.
easyBiodata,Our mission is to reimagine the arranged marriage process in India by evolving the spousal search process to give more power of control & choice to prospective spouses.
EatWell,"EatWell makes healthy eating more accessible to low-income urban families, reducing cost and inconvenience barriers with a 30 minute one pot meal kit."
ECE Management Network,"A Management Network focused on delivering high quality ECE programs for all children through effective management, training and ongoing PD."
Echelon VR,"A meditation application software that combines VR/AR, Neurofeedback,brain training, and social networking."
EchoLife,EchoLife stitches all your data on the internet and provides statistics and intelligent suggestions on your life
Ecostyle,Ecostyle creates unique business plans to lead fast fashion brands toward sustainability while making them profitable.
Ectropa,"Ectropa, a solar energy developer based in El Salvador Central America, sells electricity (at a discount to utility company) to industrial businesses at no upfront cost, through Solar ..."
EdFolio,"Edfolio helps students harness the power of online education by curating skill-specific course playlists, then connects students directly with employers through guaranteed interviews to ..."
Editplex,We develop treatments against inflammatory diseases such as MS and ALS thanks to our safer genome editing technology
EduBank,"Leveraging micro-finance to increase access to quality education in developing countries. There are more than 2,400 MFIs serving 100 Million borrowers around the world. There are also ..."
EduBright,Code what you want when you need it.
Education2Employment,"We recruit, train and allocate unemployed young adults into talent-seeking companies in Brazil"
Educational Justice Activists,We (1) select the brightest high schoolers (2) train them as tutors & (3) pair each one with a low-income 5-8th grader to tackle educational inequity.
Educational Materials,"We spread love and knowledge around the world through educational materials, workshops, trainings and conferences."
EduSaga,"The best way to learn Mandarin is to go to China, but the second is to play EduSaga, an immersive detective game that brings virtual Shanghai to your mobile phone."
EDUtainment,"EDUtainment is School House Rock for the 21st Century. We take dynamic teachers with unique takes on the Common Core Standards and give them professional-quality video and editing, then ..."
EFL,"EFL first pioneered psychometric credit scoring through research at the Harvard Center for International Development. We now work with leading financial institutions across Africa, ..."
Elektra Labs,Elektra Labs is building a platform to identify and develop digital biomarkers that can be used in decentralized research and care.
Elementa Energy Solutions,Elementa – harnessing sun power in a cost-effective thermo-electric process in order to bring energy to the world’s most underserved populations.
Elevate,"Elevate offers frictionless access to mental health services and depression medication management, including delivery, via a direct-to-consumer telemedicine platform."
Elevate,"Elevate is a convenient, fast, and fun subscription to digital mental health services"
Elevian Inc.,"Elevian develops therapeutics that stimulate regenerative capacity, to treat and prevent the diseases of aging."
Elios,An alert service for early signs of employee risk
Elizabeth Boston,Luxury retail concept store in the heart of Boston that delivers superior personalized service and carefully curated merchandise.
Ember,Ember is an e-commerce platform where service organizations can list their needs and donors in the community can allocate their resources to optimize impact.
Embodying Peace,build tech that mobilizes international volunteer networks that remotely build capacity for peacebuilding civil society
Embrace Hearing,"Embrace Hearing is an online retailer of hearing aids, offering affordable, high-quality hearing aids at a fraction of the cost of traditional dispensers."
Emote,"A platform for students to inform teachers of their emotional state, thus allowing teachers to adapt to better support students and manage classrooms."
Empanist,an online platform that connects performing artists to pianists
Employ Busoga Enterprise,Mitigate teenage pregnancy by reducing poverty and reduce employment inequality through business and youth employment
en tout cas,We are building an on-demand service for consumers to send us their favorite old clothes and have them remade.
Encite Capital,"Encite Capital exists to enable prosperity through entrepreneurship. We are founded on the principle that all entrepreneurs deserve the opportunity to be successful, and with the ..."
Endorse,Esports influencer marketing – connecting brands to video game players fro authentic product sponsorships
ENGRAM,"High-sensitivity biosensor able to detect medical & environmental cues (e.g.disease state,pollutants) by converting transient bio-events to DNA memory"
Ennate,Ennate is a high-potential talent hub that looks past the pedigree to connect exceptional candidates from non-traditional backgrounds to great firms.
Enrich,We help minority college grads achieve financial success through high quality job placement and student loan refinancing
Entobites,"Healthy, natural, and environmentally friendly cricket based dog food and treats."
Epigene Labs,Epigene Labs specializes in genomics-driven drug design for precision oncology.
Equity Endeavor,Equity Endeavor is a crowdfunding portal that allows individuals the opportunity to use an Internet portal to invest in fast growth startups and traditional small business enterprises. ...
ESCALA Education,ESCALA is a social enterprise that seeks to offer education-financing products tailored-made for low and middle-income population. We aim to build a bridge between private universities ...
Ethnologee,"In the world of mass produced goods, Ehtnologee gives you handmade and eco-friendly products that will make you stand-out."
eudios,We use machine learning to help companies understand and reduce their economic vulnerability to infectious disease outbreaks.
EuMotus,A camera-based AI-empowered movement analysis system that helps physical therapists and athletic trainers better treat physical health.
EurekaEd,Where Education Meets Entertainment.
Evera Labs,"Through a simple, one-time urine sample, Evera preserves your youngest and healthiest cells for future therapeutic use."
EverActive,Everactive strength-tracking sensor and algorithms enable affordable fitness assessment and guided personalized training.
Evisort,Evisort is on a mission to change how companies interact with their contracts and legal documents.
Excurvant,"Excurvant is the first, truly social platform for travelers, explorers, and photographers all around the world."
Eximchain,"Eximchain is a blockchain-based payment and finance platform that enables importers and exporters to transact with the security of a Letter of Credit at minimal cost, and ultimately ..."
eXlogue,"eXlogue is a language teaching exchange platform, where users can learn one-on-one language courses with native speakers by using the credits they can earn from teaching their native ..."
Experfy,Experfy is a Big Data and analytics consulting marketplace.
Exponential Nation Africa,"Creating 1 million jobs in Africa by 2025 by nurturing exponential ventures, ecosystems and institutions."
Exporta Technologies,Exporta.io is an export-as-a-service platform that helps Latin American manufacturers enter global e-commerce marketplaces.
ExtensionEngine,"Since it was founded in 2000, ExtensionEngine has worked with clients to deliver elegant and cost-effective solutions to complex technology and business challenges. Our focus is to ..."
Extensive Salon,"Extensive provides salon luxury in the comfort of your own home. For black women in the Boston area, keeping your mane maintained is no longer a hassle. Our stylists are prompt, polite, ..."
Eyes Up,Using audio feedback to give blind people information about their eye position in order to maximize residual vision and reduce nystagmus.
Factor,Factor empowers R&D teams to bring better manufactured products to market faster. Factor is a world-class connected supply chain at your fingertips.
Fair Dues,"We partner with worker organizations to increase community support for fairer working conditions through online, face-to-face and phone fundraising."
FairSetup,Fairsetup is a novel approach to employee engagement that combines impact-based compensation and collaborative evaluation.
Fairweather Chef,"Fairweather Chef offers ready-to-cook meal kits that include all the ingredients you need to make a delicious, healthy home-cooked meal. We partner with employers to deliver these meal ..."
Fam.ily,"Share/compare family metrics (health data, # of steps, meditation time) with each other for accountability + well-being."
FameNow,Pay actors/singers to record writers’ scenes/songs; writers and actors then send resulting videos to prospective agents
Family Health Plus,“Family sourced” health history to generate personalized risk profiles for current and future diseases.
FANS,Optimize fans’ experience when they consume live entertainment. Our first product is a 2-way software allowing venues to interact with fans.
Fasho,"Fasho, bringing the fashion show to the palm of your hand giving access to styles by up-and-rising fashion designers from Boston and beyond."
Fastcart,"Tired of wasting time waiting in line? As you shop, scan products with your mobile phone and checkout directly with the app. Save time, skip the line."
Fayrah,We inspire and simplify South Asian weddings in the United States.
Faze1,Faze1 is a data-powered outbound marketing platform for the home services industry. We combine consumer demographics and location-based information with a suite of tools that reinvents ...
FeedBack,FeedBack is a social media platform that turns fanatic consumer bases into external consultants for a company’s product and marketing strategy.
FeedMe Guru,Feedme Guru is a mobile app with shortlists of the best restaurants as recommended by reputable food bloggers and celebrity chefs. Download FeedMe Guru to check off all the top eats in ...
FieldSight,FieldSight is a platform for remote monitoring and supervision of humanitarian and development projects in order to improve quality and reduce risk.
Fighting For Five,Fighting for Five is a social venture operating on the promise of feeding one child for one full year for every pair of sunglasses sold.
FileAway,Low cost accounting service for small businesses over text messages enabled by using AI
FIND Surgical Sciences,FIND Surgical Sciences is developing a platform technology to integrate and visualize multi-modal neuroimaging data for improving surgical outcomes.
Find Your North,"We use machine learning to enable job-seekers to obtain quick, personalized, affordable and reliable career services, and refer peers for jobs"
Finfox,Finfox is applying artificial intelligence algorithms to simplify treasury and risk management processes at small-to-mid-sized firms.
Finvisor,"Have some money & want to know what to do with it? Use Finvisor to figure out what to do w/ your money & get a plan to take action. 10 mins, no fees, no jargon."
FinWeGo,"Offer convenient and anytime access to employee’s earned income and affordable short-term loan based on employment history, by signing up employers"
First Cabin,"Inspired by traditional Japanese hospitality and modern capsule hotels, First Cabin offers a tech-enabled, sophisticated, and affordable stay."
First Touch,"First Touch is a sophisticated performance optimization tool for teams, clubs, and professional associations built around the companies integrated suite of mobile apps."
FirstGrAID,"First GrAID is a digital learning platform that aims to be you and your child’s guide in health, safety and wellness."
Fitalyst,"Lifestyle Analytics for Busy Undergrads. Real-time data and peer-to-peer help with food, exercise, laundry, & self care."
Fitbetes,"Fitbetes, the personal medical assistant of T1 Diabetics, processes all data to help diabetics have better treatment."
Flare Jewelry,Technology that turns Accessories into Escape Buttons.
Flashcards+,Flashcards+ is just the beginning of an educational revolution that will allow anyone to learn anything.
Fleet Health,Turnkey interoperability for hospitals and clinics.
Flock,"Flock connects members of academic, corporate, and community organizations by arranging small group dinners around common interests."
Flotherm,"Flotherm is the only non-invasive, non-surface area dependent perioperative warming device that seamlessly integrates with existing surgical workflows to provide both deep-vein ..."
Flow Suit,Flow Suit is clothing with built-in electrodes that can enable paraplegics to have manual control of their legs through electronic muscle stimulation.
Flower Jungle,Striking natural flower 3-D sculptures allowing stunning semi-permanent decoration at significant savings. Sold online via subscription model.
FlowLight,Computer vision for non-invasive post-surgical and critical care monitoring.
Flume,"Flume is building a collaborative web-platform for crowdsourcing the annotation of the human genome. Our goal is to make learning about human biology easier for everyone, from ..."
fMainstream,"A crowd-curated, cross-genre platform that makes it easy for amazing emerging artists and fans to discover each other in a cool way."
FN TEST TEAM,hahahahsdaslkajdlaskjdlsakjdaslkdjasldas
Fog-Farming Dynamic System,A combined water-collection/farming system that translates survival mechanisms of a xerophytic plant into design logics to foster adaptability to climate change in desert communities.
FooFii,FooFii (“foo-fee”) is an info sharing platform helping healthcare and service providers guide food insecure patients.
Fora,"Fora: the first mobile music streaming app with free, unlimited access through a pay-what-you-want model & crowdfunding of artist projects."
Forerunner,Forerunner is a platform that enables and incentivizes cities to engage in climate adaptation planning.
ForeSight,Empower people with vision impairments with a novel wearable navigation device using soft actuators and computer vision.
Foresight Pharmaceuticals,Our mission is to develop new drugs for neglected and orphan diseases from breakthrough medical research. Our first product is a topical drug against HIV and HPV.
Forgeant,Sentiment Analysis in Real-time
Forget-Me-Not,Reminds you of someone’s name by sending a push notification to your phone when that person is nearby.
Fork,Fork is a local mobile advertising platform that links users to coupons and promotions at nearby restaurants.
Forsythia,The vision for Forsythia is to create a sustainable alternative to conventional cotton.
Four Minute Medicine,It is an educational platform in which medical information is organized & contextualised for students & junior physicians in under-resourced settings
Fractal,Fractal makes mass-market cloud computers.
Frank,"Frank is a personal, no-BS, no-judgment, real-time career mentor that helps college students more successfully navigate the school-to-work transition."
Frequenter,Frequenter is a location-based smartphone app that helps users keep track of places they like.
FROTH,"FROTH, or First Round on the House, is a drinks subscription service, providing its members with the black book guide to New York’s coolest bars. FROTH members enjoy 5 free first ..."
FuelEd,FuelEd is a human capital solution that develops teachers’ social-emotional competencies to bolster teacher retention & student achievement.
FullFill,Matching supply and demand of warehousing space in the fragmented EU market and abstraction layer (only one intermediary) for value added services.
Fund Women Directly,98% of all cash donations are directly given to women in extreme need.
FundersLink,The best way to invest in high-growth startups and nurture it in the biggest market in the world.
Fusion Learning LAB,eduPLANit is a personalized-learning system that builds an academic-network and an adaptive learning portfolio. The eduPLANit platform allows individual users to build on their learning ...
Future Island,FI will provide evidence-based education to investors that want to invest in solutions to our social and environmental
FutureFarm Agriculture Coop,FutureFarm will advance farm cooperatives by marrying tradition to technology for better access to resources & markets.
g.Root Biomedical Services,We help cancer patients find personalized targeted therapies by merging machine learning and clinical expertise.
Gain Life,Gain Life helps employers better care for their employees with a software platform that solves workforce health and productivity challenges.
Gapelia,Netflix for knowledge and ideas. We combine the best from blogging and crowdfunding to make the world a smarter place.
Garcon,"Restaurants can have a mobile presence to reach out directly to their foodies, within minutes and without any coding."
GardenShare,"GardenShare provides a mobile app-based platform to connect consumers looking for ultralocal, responsibly sourced produce with nearby home gardeners. Our mission is to reconnect people ..."
GARLIC Idealab,GARLIC is a social media platform for communicating about creative design ideas on contemporary China.
GC Therapeutics,GCTx is a synbio platform to program patient cells into any cell type 100X faster and 10X more efficiently than standard protocols for cell therapy.
Gel4Med,Gel4Med focuses on engineering smart materials to solve challenging problems in regenerative medicine.
Gen Y & Company,Gen Y and Company is a management consulting firm working with emerging Gen Y leaders and teaching executives how to thrive with Gen Y.
Gencores,"Concussions are a major public health concern. Our platform reduces the risk of concussion with customizable, smart, shock-absorbing helmet inserts."
gens,Gens is a telemedicine-enabled wellness brand that helps men get access to products for problems like hair loss and ED
Genterpret,"We help pharmaceutical companies better understand the genetics of drug response and, in the process, empower patients with access to their genetic data. By creating a community of ..."
GenUnity,"A civic leadership program that empowers individuals to affect real, systemic change in their local community."
Getaway,Getaway is your instant cabin. Our custom built tiny houses located on serene land one hour from the city allow you to disconnect and recharge for only $99 a night.
Getmii,"Getmii lets users broadcast their needs to people nearby, and connect with the people that can help them best."
Gevity,"Gevity is dedicated to creating products that help you achieve longevity of our bodies, starting with low-cost custom or"
Geyser Flicker,Geyser Flicker makes affordable time delay actuators to reduce electricity consumption by way of the electric water boiler.
GHD Digital Badges,We aim to develop a platform that healthcare delivery workers use to track and certify their skills and professional development through the use of digital credentialing.
giftplum,"There’s a perfect gift out there for everyone. Let giftplum pluck you a winner with juicy recs, fresh product reviews and plum prices."
GigLync,GigLync provides under-served blue collar employees better access to hourly jobs while improving the way employers manage hourly workforce today
Girls Health Champions,Girls Health Champions uses peer-to-peer education to train adolescents in India in critical health topics
Girls Thinking Global,Girls Thinking Global – connecting global changemakers to empower adolescent girls.
GitVista,"Git Vista is like “Google maps” for source code, providing software engineers with a zoomable, searchable map."
GIVZ,"GIVZ is a new global platform that facilitates two-click donations to elicit more frequent, spontaneous, and social giving activity."
Glassy,"Easy-to-use, stylish glasses that sync with a Google Maps-enabled smartphone app to help you navigate."
Global Alliance for Medical Innovation,"Leverage advancements in smartphone-imaging & deep learning to develop low-cost, accessible ophthalmological diagnostics"
Global Belle,Cultivating wellness confidence by building a culturally-relevant community of Arab women creators and rule breakers.
Global Impact Rating,We are a rating agency and database of social impact: we aggregate data and rate actual impact of organizations/companies in society.
Global Learners,"Global Learners designs after-school & summer programs that build leadership, interpersonal, and technical skills through project-based learning."
Global Peer Support,Global Peer Support (GPS) in China is a global community that relies on different modes of interactions to guide Chinese adolescents towards mental wellness and empowerment during their ...
Globetrotter Health,Connecting customers from developed countries who require healthcare to high-quality medical care in developing countries using a web-based platform.
GOCI,Insurance one stop solution
GoDutch,Forming a “group” on GoDutch allows users to make group purchases with a temporary credit card that charges each member of the group proportionally.
Golden Gateway Consulting,GGC is dedicated to helping businesses optimize for senior citizens via rigorous analysis and actionable recommendations
Golden Owl,Golden Owl is a web and mobile platform connecting family members with loved ones in assisted living facilities.
gomango,"gomango creates a network of intelligent refrigerated boxes, which helps the developing world move its perishable goods affordably."
Good at Names,"When someone you’ve met before is in your physical vicinity, the Good at Names app will remind you of their basic info and where/when/how you first met."
Good Thread Company,We are social impact ecommerce based manufacturer of “accessible luxury” bags whose profits are shared to support the operations of charities.
GoodStuff,GoodStuff is a community sharing platform that matches people who have stuff with people who need stuff.
Gourmenu,We are building a system to help restaurants reduce labor cost and help diners to make well-informed dining decisions.
