Reason Calendar,"Reason Calendar is a fast, beautiful calendar app (web, for now) that focuses on protecting your free time, guiding you through your day, and eliminating complexity."
rebloom,the easiest and only to buy and sell flowers after an event
Recon Therapeutics,"Developing device to fufill unmet need of complicated point-of-care delivery of biologics, providing an one-step kit for injections."
RecoverMe,"Patient-centric platform to improve outcomes following occupational injury, focused on data driven milestone assessment during the recovery process."
Recruit to Thrive,"Using institution-specific research, we help colleges recruit and admit students who are likely to retain, graduate, and thrive."
Reculture,Aims to improve literacy for learners through reading by gradually transitioning from graphic to text in a novel
Redetruck,"Platform to connect truck drivers, shippers, and service providers. Integrating social network with market place."
refug.io,Website for NGOs to track & collaborate on refugee casework with outside orgs – a “patient management” software for refugee service providers.
Rekroot,A platform that improves the tech recruiting process by facilitating the execution of project-based candidate evaluation
Relation-Shift,"Helps schools prevent, respond and resolve sexual and relationship violence & create vision and strategy for healthy student identity development."
Relim,A wearable device that able to collect and integrate multiple physiological data to indicates stress level of clinicians
Rem,"Rem is a mobile app that matches donors with high-impact charities, best aligned with their own altruistic tendencies."
ReMana,"ReMana is reinventing the way women pump, store and feed their breastmilk, through reusable bottles designed for efficient storage in the freezer."
Remindavax,Remindavax provides SMS message packages customized for particular healthcare conditions and demographics to improve health in India.
Renw,Renw makes Saving our Planet Fun! Enjoy free and simple UX that helps you take control of your energy consumption and stay in touch with your friends.
RePurposeful (fka Cures Within Reach for Cancer),We develop effective and affordable cancer treatments by using AI to repurpose non-cancer generic drugs.
ReputNation,"ReputNation’s mission is to help empower people at the base of the social pyramid build and monetize their digital reputation. For this, we design and develop targeted ..."
Research Space,"RSpace is a platform for creating, managing and sharing life sciences research data, integratable with other data sources and tools."
RESET,Flexible co-wellness spaces for relaxation and rejuvenation easily accessible to driven urban dwellers.
Resilient Modular Systems,"Resilient Modular Systems [RMS] seeks to lead innovative modular components using hybridized resilient composite materials for the building industry, focused on emerging economies."
Resistance School,"Resistance School provides training for communities to make sustained issue and electoral change that advances fairness, equality, and inclusivity."
respAIR,Democratizing access to respiratory care
Respect My Lane,Respect My Lane designs and manufactures ultra-reflective cycling gear with bold messaging to keep cyclists safer in urban environments
Resuscitation!,Resuscitation! is a virtual patient simulation for the iPhone and iPad. Step into the shoes of an ER doctor and practice your diagnostic skills in a simulated clinical setting. With ...
Retask,"At Retask, we realized a few fundamental insights about email: Most of it is useless, it takes up way too much time, and most emails are simply requests or updates. Retask is trying to ..."
ReThink,ReThink is a patented app that detects online hate and gives users a second chance to reconsider the decision to post or send offensive messages.
"ReThink, Inc.",ReThink is a patented app that detects online hate and gives users a chance to reconsider posting offensive messages.
Retroactive,"Retro sportswear inspired by the 80s and 90s, that uses the most advanced materials available and is environmentally & socially sustainable."
RevCy,RevCy pairs low-interest consumer loans to qualified patients with an innovative investment vehicle that will raise reimbursement rates for hospitals.
Revela Biotech,Revela Biotech is developing antibody fragments as PET imaging agents to non-invasively detect cancer and track the human immune system in tumors
Reveri Health,"Reveri Health is a personalized self-hypnosis program to stop smoking, delivered via Amazon Alexa and based on the research of Stanford psychiatrist David Spiegel, MD."
Revive,"Revive is an online social network aimed at fostering deeper community, societal engagement, and spiritual vitality among Christian professionals."
RiceBox,"For busy Asian students, Ricebox delivers snacks and lifestyle items from their home country’s trusted brands to give them their cultural comfort."
Right Side Health,Client management software for health coaches.
RightHand Robotics,Robot Hands that Grasp Anything.
Riparian Pharmaceuticals,Riparian is translating novel biology of the blood vessel wall into new therapeutics to promote vascular health.
Ripple Concerts,Ripple is a community marketplace where music artists and fans connect to book concerts in unique places. We expand the scope of live music by empowering fans.
Ripple Education,Ripple Education is an EdTech product that makes teachers more effective educators – it saves teachers time and improves outcomes for students
Rise: the membership,"Rise: the membership supports women’s early career success through mentorship, community and education, overcoming the most common barriers of isolation, anxiety and imposter syndrome."
Rito,Rito is a robot that provides freshly prepared burrito bowls in areas where food options are otherwise unavailable.
Rivet,Rivet is a mobile application to track and support student extra-curricular development.
RoadWarrior,A new way to stay connected while traveling. Unlimited voice and data for all your devices for just $9.99 per day.
Rockstone,Rockstone is a p2p leasing platform for university students where they can securely lend each other bridging finance at lower cost than credit cards.
room2learn,We are a design consultancy helping architects design smarter learning spaces using technology and research.
Roost Coffee Company,"Jova Coffee Company brings a simple, elegant, consistent cold-drip coffee to the home with an automated appliance"
Rooted,"Rooted aims to combat environmental degradation by introducing algae, in the form of snack foods, as a sustainable alternative to animal protein."
Roshan,Our venture utilizes speech-to-text software to empower illiterate prisoners in India to access legal assistance.
ROYALgame,Building an interactive website/chess program which can be used by children to learn chess with the maximum possible pedagogical efficiency.
RSTRO,A platform that connects unused space at food incubators with restaurants looking to expand w/o high fixed costs and with a focus on food delivery.
Rumana,Innovative clinical trial designs
Rumi Spice,"Five military veterans started a for-profit social enterprise called Rumi Spice, importing saffron to empower Afghan farmers and give them access to international markets. Rumi Spice ..."
Runway Technologies,Runway is providing data analytics and intelligence for fashion ecommerce companies. We’re using machine learning to help these companies–from fashion apps to ecommerce ...
RW Foods,"We empower Floridians to buy local produce and food products online through a lean, demand-based inventory platform."
S.U.I.T.S. Summer Institute,Summer program providing under-served high school students with experiences that advance their academic performance
SafeCycle Technologies,ST develops and sells technology for commuter bicycles. Our mission is to make city cycling as safe and secure as 21st century transport should be.
SafeStop,SafeStop is a platform for parent and schools to track bus attendance and anticipate their students’ arrival/departure.
Sagamore Hill Retreats,"Wellness retreats empower stressed professionals to increase physical/mental resiliency, life quality, and performance"
Sammaan,Mobile Medical Unit to deliver primary health care at base of the pyramid.
SanaRX,Leveraging bacterial genetic engineering to serve patients with orphan diseases of the alimentary tract.
Sattva,"Tablet-integrated fetal heart monitor for low cost, portable monitoring of antenatal checkups and labor in rural and semi-urban India."
Savanna,"Savanna HAIR connects customers to the best, licensed barbers in their city to provide in-home and in-office haircuts, saving customers time and freeing barbers from shops."
Save Identity,Built and design dignified community spaces and neighborhoods for refugee communities.
Sawubona Health,"Sawubona Health uses low-cost, personalized, and automated SMS to help patients improve their adherence to longterm medications."
Scheduling AD,Scheduling AD is using technology to rethink the system for exchanging and tracking college sports game contracts.
Schneider Economics,"Schneider Economics is creating the Wellness Quotient™, a single statistic to amalgamate the big data of healthcare."
SchoolYourself,"At School Yourself, we’re reinventing online education in the style of 1-on-1 learning. We have authored hundreds of interactive, personalized math lessons, and we use a custom ..."
Scout,"Scout is a crowd-sourcing tool for providing activity ideas to travelers. Moving away from the current model of business-focused travel reviews, which typically are biased by marketing ..."
SEA investing,SEA investing is an AI-powered company evaluation tool that automates due diligence approaches and utilizes public data to maximize the return of equity investors.
Searna Technologies,"Searna Technologies develops next generation sequencing assays that enable affordable, hypothesis-free, real-time monitoring of a patient’s tumor profile from blood sample."
Season,"Season is reimagining the packaging and manufacturing of hygiene products (toothpaste, deodorant, floss, face wash, etc.) to be better for the home planet."
SecLabs,Our SaaS platform detects sensitive data in enterprise applications to secure customer and employee information.
SECURE,Personal safety app allowing users to easily share GPS coordinates and signal for help
Seed Lab,"Bridging the Pioneer Gap by providing investment and human capital for early-stage, socially-focused startups."
Seek,Seek aims to help learners make more informed decisions when choosing an online course by personalizing your course search experience.
seelna,"seelna is an integrated healthy living program that uses a radically new approach, based on the belief that health, happiness and purpose are intrinsically linked."
sellio,"sellio finds patterns in your daily business operations, small or big, and finds ways you can save by using that data to optimize your inventory ordering."
Sello,"Kreyada is a mobile first shopping platform to buy and sell used goods near you, which is simple, engaging, trustworthy and quick and aims to disrupt the $10 bn industry dominated by ..."
Semester Foresight,"Time management in college is tough. Semester Foresight is a web app that helps students plan challenging, yet manageable, semesters. By maximizing students’ productivity, we help ..."
Sender,"Sender makes it affordable for immigrants to buy & send trucks, tractors, cars, & motorcycles back home to their family."
Sense my Form,Sense My Form is a wearable technology company that has created a set of sensors to monitor running form and provide real time feedback to runners.
Senseable Solutions,"We are an app, connected to live tabletop sensors, which informs customers in real-time of table availability at cafes"
Sensible Baby,Sensible Baby uses accurate and safe sensor technology solutions to monitor babies’ sleeping safety and brings new parents peace of mind.
Sensii,Product ID system based on material recognition.
Seratis,Team transparency and care coordination for healthcare providers. Know who to reach and send a secure message in seconds.
Serendipity,"Toys that make kids an adults know, love and care for their country"
Sereni,"Sereni is a well-being platform that provides online therapy and nutrition sessions with vetted professionals, helping working professionals in Latin America."
Serve,An online marketplace for volunteering that improves its efficacy and experience.
SESEWA,SESEWA is preparing youth in Nigeria for the world of work by equipping them with in-demand skills and connecting them w
Settlyt,"Settlyt is a digital social ledger for making, tracking, and resolving everyday competition among friends."
SexualiTea,A comprehensive digital sexual and reproductive health platform to provide information and resources to young people
Shadow,"A live video tool for new hires to watch the best employees work, ask questions, and learn what success looks like."
"Shamiri Institute, Inc.","Shamiri helps adolescents with depression & anxiety to thrive, improving mental health, grades & relationships."
Shamsina,Shamsina provides access to affordable solar technologies for energy poor communities.
ShareX,Geography based group purchasing of goods or services
Sharing Studio,A cloud-based 3D design community platform that enables design updates in real-time.
SheepyBaby,We deliver a digital health platform to planning couples to improve preconception health and improve health outcomes for both the baby and the mother.
ShelfLife,ShelfLife makes ordering from and communicating with suppliers faster and simpler – save time while boosting margins.
Shelly Xu Design,"First zero waste fashion startup with original designs that are more accessible, versatile, and fully zero waste"
Shepherd Therapeutics,Shepherd Therapeutics is a patient-centered biotechnology company aimed at developing drugs and therapies for a portfolio of rare cancers.
Shipster,Shipster allows anyone to make money delivering packages. We connect local and online deliveries with people “going there anyway.”
SHLD (Self-Healing and Loving Dialogue),"SHLD leverages social media to prevent mental health crises and promote wellness of young adults, particularly those with marginalized identities."
Shopping Cart,Shopping Cart provides users with a simpler way to manage emails and receipts received from e-commerce websites.
ShoutAbout,"Do something about current events. Beneath news articles, ShoutAbout connects people with relevant nonprofits."
Side,Side: a plug-and-play recommendation engine for ecommerce sites. Product suggestions are highly personalized by using social network data.
SidelineSwap,"SidelineSwap is a peer-to-peer marketplace where people connect to buy, sell, and trade sporting goods."
Sightglass,Sightglass is a knowledge management platform that provides organizations a frictionless way to find internal expertise and avoid reinventing the wheel. Unlike internal wikis or ...
Signature Orthodontics,We apply a new 3D ceramic printing technology to make custom orthodontic brackets to decrease time and cost of braces.
SIGNUM,A digital platform that digitally consents patients for procedures with high quality educational videos
siLAB,"siLAB is a computational contractor, automating construction systems for ecological landscapes and the public realm."
Silvia Health,Silvia Health offers a call-based service platform for early diagnosis and prevention of dementia for elderly people.
Simple.Careers,"Simple: an app that allows top students to discover and connect with employers. Way better than career fairs, but they still get swag!"
SimpleFuture,Simple Future is redesigning the $60B Unclaimed Property (UP) program to make it easier to deliver UP back to the people
Singularity,Singularity: AI-Powered Distributed Energy Networks
SiPure Membranes,SiPure Membranes is a patent-pending nanoporous silicon membrane for any filtration process.
SitterCycle,Sittercycle: great and affordable childcare for all families.
Skillist,Skillist connects talented job-seekers without four-year degrees to high-paying jobs that value their skills.
SkillStride,SkillStride is an e-learning platform providing content library & tutoring marketplace to the K-12 segment in Indonesia
Skyhook AI,Enable data-driven decision making in sports by delivering novel insights based on high-resolution player tracking data and deep learning.
Sleep Squad,Smart-Blind that gently wakes you up in the morning with natural light.
slide,"slide is an API for personal information which makes it possible to initiate and maintain user-vendor relationships without forms, while keeping both parties perfectly up to date. This ..."
Small Batch News,Daily world news podcast in 5ish minutes.
Smartnet,"With Machine Learning, we predict and cache all you need for the day with cheap home WiFi before you head out."
SmartScreen,genetic disease diagnosis
Smarty,"Smarty is an AI powered assistant for scheduling. It manages your meetings, tasks, and other deadlines while learning how to automate your to-dos."
Smidian,"Grades are obsolete. Smidian lets teachers challenge, inspire and meaningfully track students with digital badges and creative projects."
smoodi,"smoodi is making people happier and healthier with its self-cleaning machine for fresh, customized smoothies."
SMX,"What if you could create a personal, geo-tagged music playlist(s) that plays music by responding to your actual, physical location?"
Snowball Buzz,"Platform to crowdsource ideas for change within organizations, empowering people to build momentum and challenge the status quo"
Social Bookmarking,"A social bookmarking app that helps you simultaneously share, save, and discover your online identity with who you want, wherever you want."
Socrates,Matches online course data from MOOCs w/ occupation & labor market data so students can rank practical value of different MOOC credentials.
Socrates: A New Philosophy to Fashion,Socrates blends technology & fashion to create fashion products that empower consumers to live their lives their way.
Solchroma Technologies,"Solchroma is building the world’s most vivid, sunlight readable displays for large area digital signage as we envision our future in bold color."
Soldiers Field Capital Management,Soldiers Field will use a quantitative market analysis tool to speculate with options on indexes on the stock market. With the consistency of a backtested algorithm and the continual ...
SolidEnergy,"Super high energy density batteries that are rechargeable, malleable, and work safely at extremely high temperatures."
Sonation,"Sonation’s mission is to empower people to have beautiful experiences with making music, where it’s all about the individual’s creative voice. With our unique accompaniment technology, ..."
Songshark,Songshark is an automatic music company specializing in video soundtracks. We provide soundtracks on demand for social media videos.
Soocur,A social marketplace where travellers can offer their excess space to bring urgent things to people in need.
Sophya,"By leveraging computer vision and data science analysis of internet learners, Sophya helps students learn better using internet content."
sort.it,"Sortit is a tool for sorting a large set of people into smaller groups, optimizing over people’s preferences. Like Harvard’s sectioning tool, but generally accessible and adaptable."
Source: Resource App for Homelessness,"We collaborate with stakeholders in homelessness to tackle the complex issue technologically, from building a “Yelp” for"
Space Paint,"Using NASA patents, we are adapting space-based technologies to improve energy and cost savings for our customers."
Sparkle,"Our product is a STEM toy aimed at girls, intended to give girls an equal opportunity to fall in love with STEM through the power of play."
SpeakEasy,"Empowering our world to engage in genuine, live video conversations on the topics that matter most #speakeasy"
Special Agents,"A new NGO to help families raising kids with disabilities navigate the complex, overwhelming health care system."
Spectacyl,"Spectacyl is a platform that helps marketing and sales executives track their above-the-line, offline, PR and events marketing efforts and correlate that activity to their real KPIs. ..."
Speech4Good,"We create technology that lets speech therapy students monitor their progress, improve their practice, and get fluent."
SpeedVenture,"SpeedVenture is a social online platform for investing seed capital. SpeedVenture makes investing in startups social, simple, and rewarding."
Spencer Jane,"Spencer Jane is a millennial centric, branded sustainable pantsuit line."
SpinCo America,Bringing spinning-only studios to main street America.
Spirit Rock,Yelp for spiritual and religious communities augmented with tools to help individuals discover their beliefs and find matching communities
SplitNGo,"Don’t wait for your bill at the restaurant. Just pull out your phone, see your bill, and pay in 45 seconds with #SplitNGo. No app required."
Splitwise,Shared expenses.
SponsorJoy,We lower the out-of-pocket cost of weddings by connecting sponsors with targeted wedding advertising opportunities
SportLux,Performance chic clothing for women.
Sports Industry Influencers,Community building organization focused on improving D&I in sports biz through events and developing a digital network.
Spotlight,"Spotlight is transforming the way people connect with global, local, and private moments through an innovative mobile video platform."
SPOUTS OF WATER,SPOUTS OF WATER (SPOUTS) manufactures and distributes affordable ceramic water filters to improve the access to clean drinking water in Uganda.
Spray Cake,"A cutting-edge innovation in home baking, Spray Cake makes warm, fresh and delicious cake as easy as a whipped cream-style can of our batter, a pan, and an oven or microwave."
Spruce,"When you want to declutter and sell your possessions, Spruce will come pick up, package, store, and sell your personal belongings."
Spruce & Co.,"Spruce & Co creates simple products that encourage a healthy lifestyle through everyday routines. Our first product, Sprucies, are gentle, natural, disposable screen cleaning ..."
SQ Technologies,SQ’s mission is to prevent sexually transmitted infections (STIs) and significantly improve individual and public health by providing a mobile solution for individuals to share and ...
Stabilitas Ventures,SV’s Beacon App helps International NGOs keep track of employees working in developing countries and enables employees to get help during emergencies.
Stacks,"Fast, cheap, and scalable data analytics as an energy-efficient Compute-as-a-Service via specialized hw accelerator"
StakeTrak,"Automatically keep track of the stakeholders in your case, cause, or community."
StartHub Africa,StartHub Africa is an EdTech startup fighting unfulfilled potential of African talent by developing Africa’s next-generation workforce.
StatGenomics,"We use next-generation sequencing to quickly diagnose patients with any infection, including those that cannot be identified by any other means."
StatusQuota,StatusQuota provides sales technology tools to help sales reps and executives get more out of the software they use today.
Stay,Stay makes you love your city by partnering with the best organizers to curate social relationships and experiences inspired by local leaders.
Stealth Fintech Startup,"Stealth Fintech Startup is a financial data platform that empowers employers to expand smart cash transfers, the worker benefit for a better future of work."
STEAM Adventures,STEAM Adventures is an interactive storytelling app designed to support parent-child interaction and foster early interest in STEM.
STEAMline,STEAMline is an innovative tech-driven nonprofit platform that streamlines entry and retention in STEAM fields.
STEMgem,"STEMgem is a device toolkit that allows learners to build real, useful, and relevant technology. Our mission is to engage teenage girls in STEM."
STEMid,"STEMid = web platform that facilitates hands-on learning + mentorship via science, technology, engineering and math internships."
STEMINA,Develop a brand for youth to be interested in STEM through fashion & comics
Sticky,"Sticky is a line of colorful, lifestyle cases for the GoPro. Get more out of your GoPro and film everyday, not just when you are skiing and surfing."
Stitch,Stitch is a team communication platform for medical providers.
StoryEntry,We solve the time and geography issues associated with maintaining strong relationships
Stowe,Stowe is the AirBnB for storage space.
Strada,"Uses ML to automate routing of truck shipments with respect to cost, speed, environment, final configuration of trucks."
StrattyX,The StrattyX app lets you make customizable bots for your stock and crypto account.
Striva,"Providing student loan solutions tailored to the Sub-Saharan African market, Striva is SoFi for emerging markets."
Struct Club,Struct Club helps fitness instructors easily prepare and teach their group exercise classes.
Strudel Labs,Strudel is a mobile app that makes meditation easy and accesible to everyone.
Student Loop,Connecting teachers and parents with community resources to support student learning.
Studio Dental,"Do you pay for dental insurance? If so, when was the last time you’ve been to the dentist? Most people who pay for dental coverage don’t actually use it. Studio Dental is ..."
Studio Wood,"In the age of Internet of Things, why can our furniture not be smarter? Furniture could be more than just static items imagine an smart ecosystem"
